event_date,event_type,description,source,created_at
2025-11-25T08:03:27Z,satellite_deployment,NJIT scientists track recent solar flare disruptions in Earth's ionosphere,Spaceflight News API,2025-12-23T12:10:13.970235
2025-11-25T08:03:27Z,launch,BepiColombo nears Mercury orbital arrival after seven year journey,Spaceflight News API,2025-12-23T12:10:13.970256
2025-11-25T08:03:27Z,launch,End of mission for Atacama Cosmology Telescope opens new avenues in cosmology,Spaceflight News API,2025-12-23T12:10:13.970278
2025-11-25T08:03:27Z,launch,Blue Ring mission to expand commercial GEO space domain awareness,Spaceflight News API,2025-12-23T12:10:13.970299
2025-11-25T08:03:27Z,satellite_deployment,UK government commits GBP 6.9 million to boost satellite communications sector,Spaceflight News API,2025-12-23T12:10:13.970323
2025-11-25T08:03:27Z,policy_or_corporate,Looking inside icy moons,Spaceflight News API,2025-12-23T12:10:13.970351
2025-11-25T08:03:27Z,launch,BlueBird 6 satellite set for December launch to expand direct mobile connectivity in space,Spaceflight News API,2025-12-23T12:10:13.970372
2025-11-25T08:03:27Z,other,Ancient giant shark fossils reveal early mega-predator dominance in Australian seas,Spaceflight News API,2025-12-23T12:10:13.970401
2025-11-25T08:03:27Z,security_event,Mitigating radio frequency interference in US weather satellites,Spaceflight News API,2025-12-23T12:10:13.970420
2025-11-25T08:03:27Z,launch,Outage Prevention from Orbit: Why Utilities Are Turning to Satellites and Geospatial Analytics,Spaceflight News API,2025-12-23T12:10:13.970442
2025-11-25T04:38:58Z,launch,China Launches Uncrewed Replacement for Damaged Shenzhou-20,Spaceflight News API,2025-12-23T12:10:13.970467
2025-11-25T00:30:55Z,satellite_deployment,Oman brings GEO orders level with 2024 as larger spacecraft regain traction,Spaceflight News API,2025-12-23T12:10:13.970492
2025-11-24T23:17:34Z,launch,"NASA, Boeing pivot Starliner-1 mission from 4-person astronaut flight to cargo-only",Spaceflight News API,2025-12-23T12:10:13.970514
2025-11-24T22:13:53Z,launch,Shenzhou 22 set to launch uncrewed to Chinese Tiangong space station,Spaceflight News API,2025-12-23T12:10:13.970534
2025-11-24T20:34:47Z,launch,"NASA, Boeing Modify Starliner Contract: Fewer Launches, Cargo Only on Starliner-1",Spaceflight News API,2025-12-23T12:10:13.970555
2025-11-24T20:00:00Z,launch,NASA’s 2025 Astronaut Candidates: Shaping Artemis Exploration,Spaceflight News API,2025-12-23T12:10:13.970581
2025-11-24T19:30:57Z,launch,NASA to fly only cargo on next Starliner mission under modified contract,Spaceflight News API,2025-12-23T12:10:13.970657
2025-11-24T18:55:29Z,launch,NASA confirms that Starliner’s next mission will be cargo only,Spaceflight News API,2025-12-23T12:10:13.970678
2025-11-24T18:52:26Z,other,New NASA HEAT and My NASA Data Resources Bring Space Weather Science into Classrooms,Spaceflight News API,2025-12-23T12:10:13.970709
2025-11-24T18:00:00Z,other,"NASA, NOAA Rank 2025 Ozone Hole as 5th Smallest Since 1992",Spaceflight News API,2025-12-23T12:10:13.970736
2025-11-24T17:52:00Z,other,NASA Citizen Science Toolkit for Librarians,Spaceflight News API,2025-12-23T12:10:13.970765
2025-11-24T17:13:00Z,other,City Lights and Atmospheric Glow,Spaceflight News API,2025-12-23T12:10:13.970794
2025-11-24T16:53:51Z,launch,The Exploration Company Inaugurates New Facility in France,Spaceflight News API,2025-12-23T12:10:13.970819
2025-11-24T15:01:14Z,satellite_deployment,Amazon unveils production-ready gigabit-class Leo Ultra broadband terminal,Spaceflight News API,2025-12-23T12:10:13.970843
2025-11-24T14:00:00Z,security_event,Star Wars redux: the false promise of space-based missile defense,Spaceflight News API,2025-12-23T12:10:13.970864
2025-11-24T13:51:44Z,launch,"China launches TJS-21 towards Molniya orbit, lofts trio of Shijian-30 spacecraft",Spaceflight News API,2025-12-23T12:10:13.970883
2025-11-24T13:37:25Z,other,Science fiction and innovation in space,Spaceflight News API,2025-12-23T12:10:13.970910
2025-11-24T12:30:32Z,launch,"Rocket Lab chief opens up about Neutron delays, New Glenn’s success, and NASA science",Spaceflight News API,2025-12-23T12:10:13.970929
2025-11-24T10:00:00Z,policy_or_corporate,Final call to apply for ESA Internships 2026!,Spaceflight News API,2025-12-23T12:10:13.970953
2025-11-24T05:00:00Z,launch,Florida Space Coast tops 100 launches as Space Force pushes for range upgrades,Spaceflight News API,2025-12-23T12:10:13.970972
2025-11-23T23:00:00Z,policy_or_corporate,The Overview Effect: Astronaut Perspectives from 25 Years in Low Earth Orbit,Spaceflight News API,2025-12-23T12:10:13.971000
2025-11-23T22:54:25Z,policy_or_corporate,Germany outlines military space priorities in new strategy,Spaceflight News API,2025-12-23T12:10:13.971024
2025-11-23T20:47:05Z,other,"What’s Happening in Space Policy November 23-29, 2025",Spaceflight News API,2025-12-23T12:10:13.971049
2025-11-23T20:43:32Z,launch,Webb discovers rapidly growing black hole in the very early universe,Spaceflight News API,2025-12-23T12:10:13.971071
2025-11-23T12:05:41Z,launch,Thales Alenia Space Finalises Industrial Team for ESA’s Argonaut Lunar Lander,Spaceflight News API,2025-12-23T12:10:13.971095
2025-11-23T09:17:03Z,other,European Parliament member sees support for EU Space Act there,Spaceflight News API,2025-12-23T12:10:13.971122
2025-11-23T07:47:20Z,other,Cool comfort: beating the heat with high-tech clothes,Spaceflight News API,2025-12-23T12:10:13.971152
2025-11-23T07:47:20Z,policy_or_corporate,Drilling deep to study the oxygenation of Earth,Spaceflight News API,2025-12-23T12:10:13.971181
2025-11-23T07:47:20Z,other,"Calcite deposit from southern Nevada cave reveals 580,000 years of climate history",Spaceflight News API,2025-12-23T12:10:13.971211
2025-11-23T04:19:55Z,launch,Democratic Lawmakers Call for IG Investigation into Goddard Changes,Spaceflight News API,2025-12-23T12:10:13.971233
2025-11-23T03:13:39Z,launch,Live coverage: SpaceX to launch 28 Starlink satellites from Vandenberg on brand new Falcon 9 rocket,Spaceflight News API,2025-12-23T12:10:13.971252
2025-11-22T09:13:14Z,other,First next-generation Starship booster damaged in testing,Spaceflight News API,2025-12-23T12:10:13.971279
2025-11-22T07:57:10Z,launch,NASA celebrates a decade of student contributions to space crop production,Spaceflight News API,2025-12-23T12:10:13.971300
2025-11-22T07:57:10Z,policy_or_corporate,Starlab secures investment from Janus Henderson for commercial space station project,Spaceflight News API,2025-12-23T12:10:13.971332
2025-11-22T07:57:10Z,other,Moss spores withstand long term exposure outside space station,Spaceflight News API,2025-12-23T12:10:13.971363
2025-11-22T07:57:10Z,launch,Destination: Mars. First Stop: Iceland?,Spaceflight News API,2025-12-23T12:10:13.971385
2025-11-22T07:57:10Z,launch,Successful cryogenic engine start enables enhanced mission flexibility for ISRO,Spaceflight News API,2025-12-23T12:10:13.971407
2025-11-22T07:57:10Z,launch,Argonaut lunar landers to deliver cargo on Ariane 6 missions,Spaceflight News API,2025-12-23T12:10:13.971430
2025-11-22T07:57:10Z,launch,PLD Space advances MIURA 5 rocket qualification with first fully integrated unit,Spaceflight News API,2025-12-23T12:10:13.971451
2025-11-22T07:57:10Z,policy_or_corporate,40 000 near-Earth asteroids discovered!,Spaceflight News API,2025-12-23T12:10:13.971480
2025-11-22T07:57:10Z,launch,Galileo satellites to launch on Ariane 6 to enhance navigation system,Spaceflight News API,2025-12-23T12:10:13.971504
2025-11-22T07:57:10Z,other,Plasmasphere compressed by recent geomagnetic superstorm dramatically slowed recovery,Spaceflight News API,2025-12-23T12:10:13.971535
2025-11-22T07:57:10Z,launch,Lunar dust model highlights risks for spacecraft and future moon base projects,Spaceflight News API,2025-12-23T12:10:13.971559
2025-11-22T07:57:10Z,security_event,"Comet sparks scientific fascination, online furor over 'alien' origins",Spaceflight News API,2025-12-23T12:10:13.971578
2025-11-22T07:57:10Z,policy_or_corporate,Lunar impactor Theia originated near Earth and Sun analysis reveals,Spaceflight News API,2025-12-23T12:10:13.971608
2025-11-22T04:49:43Z,launch,B2Space Tests Balloon-Based Launch System,Spaceflight News API,2025-12-23T12:10:13.971631
2025-11-21T23:47:50Z,launch,Blue Origin advances Blue Ring spacecraft toward 2026 national security mission,Spaceflight News API,2025-12-23T12:10:13.971652
2025-11-21T23:30:41Z,launch,Live coverage: Falcon 9 rocket to continue Starlink deployments with launch from Cape Canaveral,Spaceflight News API,2025-12-23T12:10:13.971673
2025-11-21T22:32:28Z,ground_infrastructure,Think tank urges Europe to scale up space-based data center efforts,Spaceflight News API,2025-12-23T12:10:13.971788
2025-11-21T21:15:24Z,policy_or_corporate,NASA Awards Liquid Hydrogen Supply Contracts,Spaceflight News API,2025-12-23T12:10:13.971851
2025-11-21T21:15:15Z,satellite_deployment,"Finland’s Iceye secures Japanese contract as it advances international expansion, new satellite ranges",Spaceflight News API,2025-12-23T12:10:13.972047
2025-11-21T18:46:00Z,other,Follow CM25 online,Spaceflight News API,2025-12-23T12:10:13.972165
2025-11-21T18:25:08Z,launch,10 Years of Students Helping NASA Grow Space Food with Growing Beyond Earth,Spaceflight News API,2025-12-23T12:10:13.972294
2025-11-21T17:29:00Z,satellite_deployment,Hubble Captures Puzzling Galaxy,Spaceflight News API,2025-12-23T12:10:13.972353
2025-11-21T16:45:43Z,policy_or_corporate,ESA unveils Thales Alenia Space-led consortium for its Argonaut lunar lander,Spaceflight News API,2025-12-23T12:10:13.972385
2025-11-21T15:36:23Z,launch,Booster 18 suffers anomaly during proof testing,Spaceflight News API,2025-12-23T12:10:13.972407
2025-11-21T15:30:00Z,policy_or_corporate,CM25 priorities for Space Transportation Systems,Spaceflight News API,2025-12-23T12:10:13.972434
2025-11-21T15:00:00Z,other,25 Year of Scientific Discovery Aboard International Space Station,Spaceflight News API,2025-12-23T12:10:13.972465
2025-11-21T14:20:00Z,other,Lessons from the November 2025 solar storm,Spaceflight News API,2025-12-23T12:10:13.972484
2025-11-21T14:15:00Z,other,Week in images: 17-21 November 2025,Spaceflight News API,2025-12-23T12:10:13.972505
2025-11-21T13:30:00Z,launch,Good to go – Let's Smile (episode 4),Spaceflight News API,2025-12-23T12:10:13.972526
2025-11-21T12:12:16Z,policy_or_corporate,Newest Starship booster is significantly damaged during testing early Friday,Spaceflight News API,2025-12-23T12:10:13.972549
2025-11-21T12:00:55Z,launch,For Stoke Space “nothing else matters” but full and rapid rocket reuse,Spaceflight News API,2025-12-23T12:10:13.972569
2025-11-21T12:00:00Z,satellite_deployment,Hubble Seeks Clusters in ‘Lost Galaxy’,Spaceflight News API,2025-12-23T12:10:13.972595
2025-11-21T09:30:15Z,launch,"NASA's X-59 soars on historic first flight, marks breakthrough for quiet supersonic travel",Spaceflight News API,2025-12-23T12:10:13.972619
2025-11-21T09:30:15Z,launch,Redwire to Deliver Spacecraft for DARPA Otter VLEO Demonstration,Spaceflight News API,2025-12-23T12:10:13.972642
2025-11-21T09:30:15Z,policy_or_corporate,Chinese experiment tests lunar construction bricks after space exposure,Spaceflight News API,2025-12-23T12:10:13.972671
2025-11-21T09:30:15Z,launch,"NASA's X-59 soars on historic first flight, marks breakthrough for quiet supersonic travel",Spaceflight News API,2025-12-23T12:10:13.972692
2025-11-21T09:30:15Z,policy_or_corporate,Water production on exoplanets revealed by pressure experiments,Spaceflight News API,2025-12-23T12:10:13.972728
2025-11-21T09:30:15Z,launch,Radiation hardened circuit platform expands space electronics development,Spaceflight News API,2025-12-23T12:10:13.972752
2025-11-21T09:30:15Z,policy_or_corporate,NASA backs dust tolerant wireless power links for Moon and Mars vehicles,Spaceflight News API,2025-12-23T12:10:13.972780
2025-11-21T09:30:15Z,launch,New satellites boost China's orbital technology capabilities,Spaceflight News API,2025-12-23T12:10:13.972801
2025-11-21T09:30:15Z,other,A new angle of study for unveiling black hole secrets,Spaceflight News API,2025-12-23T12:10:13.972831
2025-11-21T09:30:15Z,satellite_deployment,How small satellites can help the US win the space race,Spaceflight News API,2025-12-23T12:10:13.972856
2025-11-21T09:30:15Z,other,Cassini study reveals organic compounds from Enceladus ocean plume,Spaceflight News API,2025-12-23T12:10:13.972887
2025-11-21T09:30:15Z,satellite_deployment,How smarter satellite teamwork can speed up connections in space,Spaceflight News API,2025-12-23T12:10:13.972910
2025-11-21T09:30:15Z,launch,Next-generation satellites from Spire Global prepared for SpaceX Falcon 9 Twilight mission,Spaceflight News API,2025-12-23T12:10:13.972931
2025-11-21T09:22:45Z,launch,ESA to Build €20 Million Human and Robotic Exploration Hub in Germany,Spaceflight News API,2025-12-23T12:10:13.972956
2025-11-21T09:00:00Z,other,Finding star clusters in the Lost Galaxy,Spaceflight News API,2025-12-23T12:10:13.972975
2025-11-21T09:00:00Z,other,Earth from Space: The Danakil Depression,Spaceflight News API,2025-12-23T12:10:13.972993
2025-11-21T08:05:00Z,launch,Marking one year until BepiColombo reaches Mercury,Spaceflight News API,2025-12-23T12:10:13.973015
2025-11-21T08:00:00Z,policy_or_corporate,The epic adventures of BepiColombo - Part 2: It’s a long way to Mercury,Spaceflight News API,2025-12-23T12:10:13.973039
2025-11-21T07:18:46Z,other,Janus Henderson invests in Starlab Space,Spaceflight News API,2025-12-23T12:10:13.973063
2025-11-21T02:37:50Z,policy_or_corporate,Saltzman: Aquisition Reform is a “Generational Opportunity”,Spaceflight News API,2025-12-23T12:10:13.973087
2025-11-20T23:13:48Z,policy_or_corporate,Europa Clipper Captures Uranus With Star Tracker Camera,Spaceflight News API,2025-12-23T12:10:13.973115
2025-11-20T23:04:21Z,launch,Blue Origin announces New Glenn upgrade plans,Spaceflight News API,2025-12-23T12:10:13.973133
2025-11-20T22:43:03Z,launch,Live coverage: Falcon 9 Starlink mission marks 100th launch of the year from Florida’s Space Coast,Spaceflight News API,2025-12-23T12:10:13.973152
2025-11-20T22:12:56Z,launch,NASA’s Quesst Mission Marks X-59’s Historic First Flight,Spaceflight News API,2025-12-23T12:10:13.973174
2025-11-20T22:09:24Z,launch,China prepares to launch uncrewed Shenzhou as maiden launches slip for commercial launch providers,Spaceflight News API,2025-12-23T12:10:13.973194
2025-11-20T21:16:20Z,launch,NASA’s Scott Tingle to Serve as Agency’s Chief Astronaut,Spaceflight News API,2025-12-23T12:10:13.973216
2025-11-20T20:46:58Z,launch,Electron launches confidential commercial satellite,Spaceflight News API,2025-12-23T12:10:13.973234
2025-11-20T20:06:50Z,other,"NASA Celebrates Five Years of Artemis Accords, Welcomes 3 New Nations",Spaceflight News API,2025-12-23T12:10:13.973264
2025-11-20T19:34:00Z,launch,NASA Sets Coverage for Crew Launch to Join Station Expedition,Spaceflight News API,2025-12-23T12:10:13.973285
2025-11-20T19:31:11Z,other,What’s Up: November 2025 Skywatching Tips from NASA,Spaceflight News API,2025-12-23T12:10:13.973314
2025-11-20T18:06:41Z,launch,Blue Origin says it’s just getting started with the New Glenn rocket,Spaceflight News API,2025-12-23T12:10:13.973333
2025-11-20T17:51:01Z,other,NASA Fuels Discovery from Earth to Sky: One Crayon at a Time,Spaceflight News API,2025-12-23T12:10:13.973362
2025-11-20T17:24:25Z,launch,NASA Progresses Toward Artemis II Moon Mission,Spaceflight News API,2025-12-23T12:10:13.973383
2025-11-20T17:22:11Z,policy_or_corporate,Space Force roadmap set to define what the service needs and why,Spaceflight News API,2025-12-23T12:10:13.973409
2025-11-20T17:18:56Z,launch,NASA’s Quesst Mission Marks X-59’s Historic First Flight,Spaceflight News API,2025-12-23T12:10:13.973430
2025-11-20T17:18:31Z,launch,"NASA, Aerospace Corporation Study Sharpens Focus on Ammonia Emissions",Spaceflight News API,2025-12-23T12:10:13.973453
2025-11-20T17:02:18Z,launch,Blue Origin announce upgrades to New Glenn ahead of Flight 3,Spaceflight News API,2025-12-23T12:10:13.973473
2025-11-20T16:56:12Z,launch,Atlas V delivers ViaSat-3 F2,Spaceflight News API,2025-12-23T12:10:13.973490
2025-11-20T16:42:53Z,launch,X-59 First Flight Media Resources,Spaceflight News API,2025-12-23T12:10:13.973512
2025-11-20T16:05:44Z,launch,I Am Artemis: Ethan Jacobs,Spaceflight News API,2025-12-23T12:10:13.973534
2025-11-20T15:38:03Z,policy_or_corporate,New Citizen Science Proposals Funded in 2025,Spaceflight News API,2025-12-23T12:10:13.973561
2025-11-20T15:10:22Z,satellite_deployment,NASA’s TESS Spacecraft Triples Size of Pleiades Star Cluster,Spaceflight News API,2025-12-23T12:10:13.973585
2025-11-20T15:00:00Z,other,NASA’s Roman Could Bring New Waves of Information on Galaxy’s Stars,Spaceflight News API,2025-12-23T12:10:13.973616
2025-11-20T15:00:00Z,launch,NASA Stennis Engineer Follows Family Footsteps into NASA’s Artemis Era,Spaceflight News API,2025-12-23T12:10:13.973637
2025-11-20T14:00:00Z,other,The ultimate backup: why humanity needs a lunar seed vault — now,Spaceflight News API,2025-12-23T12:10:13.973667
2025-11-20T14:00:00Z,policy_or_corporate,Voyager Technologies acquires Estes Energetics,Spaceflight News API,2025-12-23T12:10:13.973690
2025-11-20T13:46:52Z,launch,The Exploration Company Acquires German Additive Manufacturing Company,Spaceflight News API,2025-12-23T12:10:13.973715
2025-11-20T13:05:00Z,policy_or_corporate,ESA awards excellent suppliers,Spaceflight News API,2025-12-23T12:10:13.973737
2025-11-20T13:00:00Z,launch,Smile approved for launch in spring 2026,Spaceflight News API,2025-12-23T12:10:13.973755
2025-11-20T11:50:07Z,other,Reimagining space stations for the commercial age,Spaceflight News API,2025-12-23T12:10:13.973782
2025-11-20T11:23:46Z,satellite_deployment,Redesigned satellite battery set to advance LEO power systems,Spaceflight News API,2025-12-23T12:10:13.973806
2025-11-20T11:23:46Z,launch,Frontgrade unveils SADA-10 drive to increase efficiency for LEO and MEO satellites,Spaceflight News API,2025-12-23T12:10:13.973828
2025-11-20T11:23:46Z,other,Faraday Effect Reveals Magnetic Role of Light in New Study,Spaceflight News API,2025-12-23T12:10:13.973860
2025-11-20T11:23:46Z,other,Astrophysics study sets new bounds on speed of light across photon energies,Spaceflight News API,2025-12-23T12:10:13.973889
2025-11-20T11:23:46Z,satellite_deployment,Orbital cloud project to combine solar powered AI compute and satellite network in low Earth orbit,Spaceflight News API,2025-12-23T12:10:13.973913
2025-11-20T10:30:00Z,policy_or_corporate,ESA’s Argonaut press conference,Spaceflight News API,2025-12-23T12:10:13.973937
2025-11-20T10:00:00Z,policy_or_corporate,Argonaut lunar lander family grows,Spaceflight News API,2025-12-23T12:10:13.973963
2025-11-20T09:48:51Z,policy_or_corporate,Industry expects Germany to increase ESA contributions,Spaceflight News API,2025-12-23T12:10:13.973988
2025-11-20T09:31:00Z,launch,Galileo to take its first flight on Ariane 6 on 17 December,Spaceflight News API,2025-12-23T12:10:13.974009
2025-11-20T08:45:00Z,policy_or_corporate,40 000 near-Earth asteroids discovered!,Spaceflight News API,2025-12-23T12:10:13.974037
2025-11-20T07:41:10Z,launch,SpaceForest Announces Launch Date for PERUN Return-to-Flight Mission,Spaceflight News API,2025-12-23T12:10:13.974058
2025-11-20T04:47:38Z,launch,Preparing pads for SpaceX’s future Starship cadence,Spaceflight News API,2025-12-23T12:10:13.974079
2025-11-20T03:56:04Z,ground_infrastructure,SSC introduces streamlined ground station service,Spaceflight News API,2025-12-23T12:10:13.974099
2025-11-19T22:52:52Z,other,Celebrating 25 Years of Humanity in Space,Spaceflight News API,2025-12-23T12:10:13.974131
2025-11-19T22:08:10Z,launch,"NASA’s X-59 Completes First Flight, Prepares for More Flight Testing",Spaceflight News API,2025-12-23T12:10:13.974153
2025-11-19T21:15:09Z,policy_or_corporate,SARP 2025 Closeout,Spaceflight News API,2025-12-23T12:10:13.974181
2025-11-19T21:14:40Z,launch,SARP East 2025 Atmospheric Chemistry Group,Spaceflight News API,2025-12-23T12:10:13.974204
2025-11-19T21:14:18Z,other,SARP East 2025 Terrestrial Fluxes Group,Spaceflight News API,2025-12-23T12:10:13.974234
2025-11-19T21:13:57Z,other,SARP East 2025 Oceans Group,Spaceflight News API,2025-12-23T12:10:13.974262
2025-11-19T21:13:43Z,other,SARP West 2025 Aerosols Group,Spaceflight News API,2025-12-23T12:10:13.974292
2025-11-19T21:13:15Z,other,SARP West 2025 Land Group,Spaceflight News API,2025-12-23T12:10:13.974322
2025-11-19T21:13:06Z,other,SARP West 2025 Oceans Group,Spaceflight News API,2025-12-23T12:10:13.974351
2025-11-19T21:12:57Z,other,SARP West 2025 Whole Air Sampling Group,Spaceflight News API,2025-12-23T12:10:13.974379
2025-11-19T21:11:29Z,other,SARP East 2025 Ecohydrology Group,Spaceflight News API,2025-12-23T12:10:13.974409
2025-11-19T20:56:57Z,other,NASA’s Mars Spacecraft Capture Images of Comet 3I/ATLAS,Spaceflight News API,2025-12-23T12:10:13.974436
2025-11-19T20:15:26Z,other,View Interstellar Comet 3I/ATLAS Through NASA’s Multiple Lenses,Spaceflight News API,2025-12-23T12:10:13.974465
2025-11-19T18:28:10Z,launch,"Italian-Dutch space company Revolv Space launches new, larger solar array drive assembly",Spaceflight News API,2025-12-23T12:10:13.974487
2025-11-19T16:29:19Z,launch,NASA Cassini Study Finds Organics ‘Fresh’ From Ocean of Enceladus,Spaceflight News API,2025-12-23T12:10:13.974509
2025-11-19T16:02:00Z,other,"Webb First to Show 4 Dust Shells ‘Spiraling’ Apep, Limits Long Orbit",Spaceflight News API,2025-12-23T12:10:13.974536
2025-11-19T16:00:00Z,security_event,Kymeta and iRocket working on multi-orbit Golden Dome interceptor connectivity,Spaceflight News API,2025-12-23T12:10:13.974554
2025-11-19T15:30:00Z,satellite_deployment,ESA Navigation at 2025 Ministerial Council,Spaceflight News API,2025-12-23T12:10:13.974579
2025-11-19T15:18:38Z,satellite_deployment,OQ Technology demos European emergency smartphone alert from space,Spaceflight News API,2025-12-23T12:10:13.974601
2025-11-19T14:38:45Z,launch,Experience the Launch of Artemis II,Spaceflight News API,2025-12-23T12:10:13.974621
2025-11-19T14:30:04Z,launch,Katalyst selects Pegasus to launch Swift reboost mission,Spaceflight News API,2025-12-23T12:10:13.974640
2025-11-19T14:22:54Z,satellite_deployment,Redwire lands $44 million DARPA award to build air-breathing satellite,Spaceflight News API,2025-12-23T12:10:13.974661
2025-11-19T14:00:00Z,other,‘Department of War’ Executive Order should prioritize readiness against space stalkers,Spaceflight News API,2025-12-23T12:10:13.974694
2025-11-19T14:00:00Z,satellite_deployment,Quindar raises $18 million to scale satellite operations software,Spaceflight News API,2025-12-23T12:10:13.974714
2025-11-19T13:00:00Z,other,"Galileo, advancing toward the future",Spaceflight News API,2025-12-23T12:10:13.974736
2025-11-19T11:50:26Z,policy_or_corporate,Senate Commerce Committee schedules hearing on Isaacman renomination,Spaceflight News API,2025-12-23T12:10:13.974762
2025-11-19T11:00:00Z,launch,"Station Nation: Meet Alyssa Yockey, Neutral Buoyancy Laboratory Flight Lead",Spaceflight News API,2025-12-23T12:10:13.974784
2025-11-19T09:37:04Z,launch,Canada Commits $528.5 Million to European Space Agency Programmes,Spaceflight News API,2025-12-23T12:10:13.974809
2025-11-19T07:16:16Z,other,Gravitational wave detectors complete two year campaign with record signal count,Spaceflight News API,2025-12-23T12:10:13.974838
2025-11-19T07:16:16Z,security_event,New Laboratory Showcases Advanced Satcom Capabilities for Australian Defence Force,Spaceflight News API,2025-12-23T12:10:13.974856
2025-11-19T07:16:16Z,other,Ancient 'animal GPS system' identified in magnetic fossils,Spaceflight News API,2025-12-23T12:10:13.974884
2025-11-19T07:16:16Z,launch,Power grid agreement to supply energy for Loft Orbital satellites,Spaceflight News API,2025-12-23T12:10:13.974906
2025-11-19T07:16:16Z,launch,Machine learning tool distinguishes signs of life from non-living compounds in space samples,Spaceflight News API,2025-12-23T12:10:13.974928
2025-11-19T07:16:16Z,launch,Kepler sets January launch for optical data relay satellites to expand in-orbit connectivity,Spaceflight News API,2025-12-23T12:10:13.974948
2025-11-19T05:20:08Z,policy_or_corporate,U.S. government and companies criticize draft EU Space Act,Spaceflight News API,2025-12-23T12:10:13.974971
2025-11-19T03:37:18Z,launch,European officials stress space autonomy despite lingering dependencies,Spaceflight News API,2025-12-23T12:10:13.974991
2025-11-18T23:35:01Z,launch,Ursa Major secures $100 million in new capital as it leans hard into defense work,Spaceflight News API,2025-12-23T12:10:13.975010
2025-11-18T22:56:57Z,satellite_deployment,Eutelsat approves nearly $1 billion capital boost,Spaceflight News API,2025-12-23T12:10:13.975036
2025-11-18T18:52:24Z,launch,L3Harris testing brand new RS-25 engines for future Artemis launches,Spaceflight News API,2025-12-23T12:10:13.975055
2025-11-18T18:45:59Z,policy_or_corporate,"Curiosity Blog, Sols 4716-4722: Drilling Success at Nevado Sajama",Spaceflight News API,2025-12-23T12:10:13.975083
2025-11-18T18:41:54Z,satellite_deployment,"Curiosity Blog, Sols 4709-4715: Drilling High and Low in the Boxwork Unit",Spaceflight News API,2025-12-23T12:10:13.975108
2025-11-18T17:45:46Z,other,NASA Telescopes View Spiral Galaxy,Spaceflight News API,2025-12-23T12:10:13.975135
2025-11-18T17:05:33Z,launch,Live coverage: SpaceX to resume early evening launches after FAA restrictions lifted,Spaceflight News API,2025-12-23T12:10:13.975155
2025-11-18T16:00:00Z,security_event,The next generation of radar needed to detect micro-debris and enable a safer LEO,Spaceflight News API,2025-12-23T12:10:13.975174
