title,summary,source,source_api,published_date,event_type,is_space_related,is_security_related,countries,entities,raw_source,time_classified
Rollout Brings the Dawn of Artemis II,"Early Saturday morning, NASA rolled out the Space Launch System rocket and Orion spacecraft that will send humans back to the Moon for the first time in 54 years.",Spaceflight News API,spaceflight_news,2026-01-17 20:02:14+00:00,launch,True,False,['United States of America'],['NASA'],35473,2026-01-17 20:56:32.586981
SLS/Orion rolls to pad for Artemis 2,"
NASA’s Space Launch System and Orion spacecraft rolled to the launch pad for the Artemis 2 mission Jan. 17, though uncertainty remains about when it will be ready to launch.
The post SLS/Orion rolls to pad for Artemis 2 appeared first on SpaceNews.",Spaceflight News API,spaceflight_news,2026-01-17 18:09:55+00:00,launch,True,False,['United States of America'],['NASA'],35472,2026-01-17 20:56:32.589578
China hit by dual launch failures as Long March 3B and Ceres-2 debut mission fail,"
China suffered a pair of launch failures Friday, seeing the loss of a classified Shijian satellite and the failed first launch of the Ceres-2 rocket
The post China hit by dual launch failures as Long March 3B and Ceres-2 debut mission fail appeared first on SpaceNews.",Spaceflight News API,spaceflight_news,2026-01-17 10:34:47+00:00,launch,True,False,['China'],[],35469,2026-01-17 20:56:32.594188
Arianespace to launch first Ariane 64 rocket on 12 Feb,"Arianespace has announced that the first flight of its more powerful four-booster Ariane 6 will be launched on 12 February from the Guiana Space Centre in French Guiana. The inaugural flight of the Ariane 6 launch system was conducted in July 2024. In 2025, Arianespace launched four flights of the rocket carrying payloads for ESA, […]
The post Arianespace to launch first Ariane 64 rocket on 12 Feb appeared first on European Spaceflight.",Spaceflight News API,spaceflight_news,2026-01-17 05:00:12+00:00,launch,True,False,['France'],"['Arianespace', 'ESA']",35468,2026-01-17 20:56:32.597369
NASA’s SpaceX Crew-11 to Discuss Space Station Science Mission,"After 167 days in space, the crew members of NASA’s SpaceX Crew-11 mission will hold a news conference at 2:15 p.m. EST, Wednesday, Jan. 21, at the agency’s Johnson Space Center in Houston to discuss their science expedition aboard the International Space Station. NASA astronauts Zena Cardman and Mike Fincke, JAXA (Japan Aerospace Exploration Agency) astronaut Kimiya Yui, and Roscosmos […]",Spaceflight News API,spaceflight_news,2026-01-16 23:18:49+00:00,launch,True,False,"['Japan', 'Russia', 'United States of America']","['JAXA', 'NASA', 'Roscosmos', 'SpaceX']",35467,2026-01-17 20:56:32.600879
Indra Group writes off damaged SpainSat NG 2,"
The operator of a Spanish military communications satellite that suffered a “space particle” strike has written off the spacecraft, concluding it can no longer carry out its mission.
The post Indra Group writes off damaged SpainSat NG 2 appeared first on SpaceNews.",Spaceflight News API,spaceflight_news,2026-01-16 22:49:32+00:00,launch,True,True,['Spain'],['Other'],35465,2026-01-17 20:56:32.607331
SLS/Orion Ready to Roll for Artemis II,NASA is proceeding with plans to roll the Space Launch System rocket with the Orion crew capsule out to Launch Complex-39A at Kennedy Space Center tomorrow morning. The SLS/Orion combination […],Spaceflight News API,spaceflight_news,2026-01-16 21:47:22+00:00,launch,True,False,['United States of America'],['NASA'],35463,2026-01-17 20:56:32.610238
Isar Aerospace sets date for second Spectrum launch,"
German launch company Isar Aerospace is preparing for the second launch of its Spectrum rocket, this time carrying several satellite payloads.
The post Isar Aerospace sets date for second Spectrum launch appeared first on SpaceNews.",Spaceflight News API,spaceflight_news,2026-01-16 18:52:46+00:00,launch,True,False,['Germany'],['Isar Aerospace'],35460,2026-01-17 20:56:32.612672
China conducts static fire test of new reusable Long March 12B rocket,"
China’s main space contractor performed a static fire test of a new reusable Long March rocket Friday, paving the way for a test flight.
The post China conducts static fire test of new reusable Long March 12B rocket appeared first on SpaceNews.",Spaceflight News API,spaceflight_news,2026-01-16 18:06:43+00:00,launch,True,False,['China'],[],35459,2026-01-17 20:56:32.616012
"Live coverage: NRO, SpaceX to launch reconnaissance satellites from Vandenberg",The NROL-105 mission is the first of about a dozen missions planned for 2026 that support the NRO’s so-called proliferated architecture satellite constellation. Liftoff from pad 4E at Vandenberg Space Force Base is scheduled for 8:18 p.m. PST (11:18 p.m. EST / 0418 UTC).,Spaceflight News API,spaceflight_news,2026-01-16 16:53:05+00:00,security_event,True,False,['United States of America'],"['SpaceX', 'US Space Force']",35457,2026-01-17 20:56:32.620080
AO-Resistant Material Boosts VLEO Satellite Longevity,"
Deposition Sciences, Inc. (DSI), a wholly owned subsidiary of Lockheed Martin, specializes in advanced materials and optical coatings. For over 20 years, they’ve been producing their Sunshade® thermal control material, […]
The post AO-Resistant Material Boosts VLEO Satellite Longevity appeared first on SpaceNews.",Spaceflight News API,spaceflight_news,2026-01-16 15:21:42+00:00,satellite_deployment,True,False,[],['Lockheed Martin'],35456,2026-01-17 20:56:32.623449
Out of This World Discoveries: Space Station Research in 2025,"As Earth completed its orbit around the Sun to close out 2025, the International Space Station circled our planet more than 5,800 times. Serving as humanity’s unique laboratory in space, the station has hosted thousands of experiments and technology demonstrations, advancing science in ways that cannot be replicated on Earth. In 2025 alone, more than […]",Spaceflight News API,spaceflight_news,2026-01-16 15:00:00+00:00,policy_or_corporate,True,False,[],[],35455,2026-01-17 20:56:32.632108
NASA’s Crawler Preps for Artemis II Rollout,"NASA’s Crawler-transporter 2 moves toward the Vehicle Assembly Building at NASA’s Kennedy Space Center in Florida on Friday, Jan. 9, 2026. The crawler will transport NASA’s SLS (Space Launch System) rocket with the Orion spacecraft to Launch Complex 39B ahead of the Artemis II launch which will journey Commander Reid Wiseman, Pilot Victor Glover, and […]",Spaceflight News API,spaceflight_news,2026-01-16 14:37:26+00:00,launch,True,False,['United States of America'],['NASA'],35453,2026-01-17 20:56:32.641937
The countdown to clean orbits has begun with ESA’s Zero Debris Charter,"
Space is rapidly becoming the world’s most congested frontier. What was once a domain of scientific exploration is now a crowded commercial arena, a global infrastructure layer critical to communications, navigation, climate monitoring and defense. Yet this dependence is threatened by a growing, largely invisible hazard: orbital debris. The European Space Agency’s Zero Debris Technical […]
The post The countdown to clean orbits has begun with ESA’s Zero Debris Charter appeared first on SpaceNews.",Spaceflight News API,spaceflight_news,2026-01-16 14:00:00+00:00,security_event,True,True,[],['ESA'],35452,2026-01-17 20:56:32.644911
Rocket Report: Ariane 64 to debut soon; India has a Falcon 9 clone too?,"""We are fundamentally shifting our approach to securing our munitions supply chain.""",Spaceflight News API,spaceflight_news,2026-01-16 12:00:50+00:00,launch,True,False,['India'],[],35450,2026-01-17 20:56:32.646575
Planet secures multi year satellite contract with Swedish Armed Forces,"Los Angeles CA (SPX) Jan 13, 2026


Planet Labs PBC has signed a multi year, low nine figure agreement with the Swedish Armed Forces to deliver a suite of satellites, space based data and awareness solutions in support of Sweden's peace and security operations. 

The contract gives Sweden ownership of a fleet of Planet satellites alongside access to high resolution imagery and intelligence solutions, providing a sovereign spac",Spaceflight News API,spaceflight_news,2026-01-16 11:40:08+00:00,satellite_deployment,True,False,['Sweden'],['Planet Labs'],35445,2026-01-17 20:56:32.649425
ThinkOrbital raises seed funding to advance orbital defense and construction systems,"Los Angeles CA (SPX) Jan 14, 2026


ThinkOrbital Inc has closed a Seed Round led by TFX Capital to accelerate development of its defense-driven space capabilities, on-orbit servicing solutions, and in-space construction technologies. 

The company positions itself as a pioneer of the next generation of space superiority and orbital infrastructure, aiming to support both national security and commercial missions with systems th",Spaceflight News API,spaceflight_news,2026-01-16 11:40:08+00:00,launch,True,True,[],[],35442,2026-01-17 20:56:32.652527
Multiple spacecraft track evolving solar storm to improve space weather forecasts,"Tokyo, Japan (SPX) Jan 14, 2026


At times the sun ejects massive clouds of energetic material into space, and these events can disturb satellites, threaten astronauts and even affect power grids on the ground. Researchers are working to understand how these eruptions travel through the solar system so they can develop reliable space weather forecasts that protect critical technology and infrastructure. 

A team including sc",Spaceflight News API,spaceflight_news,2026-01-16 11:40:08+00:00,security_event,True,False,['Japan'],[],35444,2026-01-17 20:56:32.657599
Spire adds hyperspectral sounder and Myriota payloads on SpaceX Twilight launch,"Los Angeles CA (SPX) Jan 13, 2026


Spire Global Inc has successfully launched nine satellites on SpaceXs Twilight mission from Vandenberg Space Force Base, further expanding its space based sensing and Internet of Things service portfolio. 

The mission carried Spires Hyperspectral Microwave Sounder, or HyMS, a compact satellite based demonstrator designed to advance global weather forecasting from orbit. HyMS is engineered t",Spaceflight News API,spaceflight_news,2026-01-16 11:40:08+00:00,launch,True,False,['United States of America'],"['SpaceX', 'US Space Force']",35446,2026-01-17 20:56:32.661288
Japanese launch company Interstellar Technologies raises $130 million,"Japanese launch vehicle startup Interstellar Technologies has raised nearly $130 million to continue development of its Zero small launch vehicle.
The post Japanese launch company Interstellar Technologies raises $130 million appeared first on SpaceNews.",Spaceflight News API,spaceflight_news,2026-01-16 11:21:58+00:00,launch,True,False,['Japan'],[],35448,2026-01-17 20:56:32.663390
What happens when fire ignites in space? 'A ball of flame',"Paris, France (AFP) Jan 14, 2026


 When fire breaks out in the low-gravity, high-stakes conditions inside spacecraft or space stations, it behaves very differently than back here on Earth.  

So, as humans aim to set foot on Mars in the coming decades, researchers are seeking to learn how flames spark and spread in space - and how best to stamp them out. 

The deadly threat fire poses in space goes all the way back to the fi",Spaceflight News API,spaceflight_news,2026-01-16 11:04:13+00:00,security_event,True,True,['France'],[],35437,2026-01-17 20:56:32.666396
"China launches AlSat-3A for Algeria, Ceres-1 sea launch adds to Tianqi constellation","China conducted its third and fourth launches of 2026 with Long March 2C and Ceres-1 rockets lifting off from Jiuquan and a sea platform respectively.
The post China launches AlSat-3A for Algeria, Ceres-1 sea launch adds to Tianqi constellation appeared first on SpaceNews.",Spaceflight News API,spaceflight_news,2026-01-16 10:51:15+00:00,launch,True,False,"['Algeria', 'China']",[],35447,2026-01-17 20:56:32.668731
Second Isar Aerospace Spectrum Flight Set for 20 to 23 January,"German launch services provider Isar Aerospace is preparing for the second flight of its two-stage Spectrum rocket, with a Notice to Mariners (NOTMAR) indicating launch opportunities from 20 to 23 January. Isar Aerospace launched its first Spectrum rocket in March 2025 from the Andøya Spaceport in Norway, but it failed less than a minute into […]
The post Second Isar Aerospace Spectrum Flight Set for 20 to 23 January appeared first on European Spaceflight.",Spaceflight News API,spaceflight_news,2026-01-16 09:32:20+00:00,launch,True,False,"['Germany', 'Norway']","['ESA', 'Isar Aerospace']",35435,2026-01-17 20:56:32.671664
NASA’s SpaceX Crew-11 Wraps Up Space Station Science,"NASA’s SpaceX Crew-11 mission with agency astronauts Zena Cardman and Mike Fincke, JAXA (Japan Aerospace Exploration Agency) astronaut Kimiya Yui, and Roscosmos cosmonaut Oleg Platonov returned to Earth after a long-duration mission aboard the International Space Station. During their stay, Cardman, Fincke, and Yui contributed more than 850 hours of research to help prepare humanity […]",Spaceflight News API,spaceflight_news,2026-01-15 20:37:23+00:00,launch,True,False,"['Japan', 'Russia', 'United States of America']","['JAXA', 'NASA', 'Roscosmos', 'SpaceX']",35428,2026-01-17 20:56:32.674514
Eutelsat Awards MaiaSpace Multi-Launch Contract for OneWeb Satellites,"French rocket builder MaiaSpace has signed an agreement with Eutelsat to perform multiple launches to support the expansion of the company’s OneWeb satellite constellation. MaiaSpace was founded in 2022 as a wholly owned subsidiary of ArianeGroup. The company is developing a two-stage, partially reusable launch vehicle called Maia, designed to deliver up to 4,000 kilograms […]
The post Eutelsat Awards MaiaSpace Multi-Launch Contract for OneWeb Satellites appeared first on European Spaceflight.",Spaceflight News API,spaceflight_news,2026-01-15 18:28:45+00:00,launch,True,False,['France'],"['ESA', 'Eutelsat', 'OneWeb']",35426,2026-01-17 20:56:32.677295
Parsons buys Altamira for $375 million to expand space and intelligence portfolio,"
The acquisition brings missile-warning and space data analytics capabilities
The post Parsons buys Altamira for $375 million to expand space and intelligence portfolio appeared first on SpaceNews.",Spaceflight News API,spaceflight_news,2026-01-15 15:36:33+00:00,security_event,True,True,[],[],35422,2026-01-17 20:56:32.679131
CNES Launches €1 Million AI Space Data Challenge,"The French space agency CNES and the Île-de-France region, which includes Paris, have partnered to launch a €1 million challenge focused on the use of artificial intelligence to analyse satellite data. Originally announced at the Paris Air Show in June 2025, the challenge forms part of the Île-de-France Region’s AI Challenge framework, launched in 2019 […]
The post CNES Launches €1 Million AI Space Data Challenge appeared first on European Spaceflight.",Spaceflight News API,spaceflight_news,2026-01-15 14:52:29+00:00,launch,True,False,['France'],['ESA'],35420,2026-01-17 20:56:32.681719
TrustPoint demonstrates non-GPS navigation for LEO satellites,"
The company’s ground station transmitted time and tracking signals to a spacecraft in orbit
The post TrustPoint demonstrates non-GPS navigation for LEO satellites appeared first on SpaceNews.",Spaceflight News API,spaceflight_news,2026-01-15 14:30:00+00:00,ground_infrastructure,True,False,[],[],35419,2026-01-17 20:56:32.683324
Portal Space selects ‘Space Armor’ debris shield for 2026 mission,"
Atomic-6’s composite material will get its first in-orbit test 
The post Portal Space selects ‘Space Armor’ debris shield for 2026 mission appeared first on SpaceNews.",Spaceflight News API,spaceflight_news,2026-01-15 14:00:00+00:00,launch,True,False,[],[],35418,2026-01-17 20:56:32.684859
Slingshot wins $27 million Space Force contract for AI training system,"
The Space Force is trying to modernize how satellite operators train for conflict in orbit
The post Slingshot wins $27 million Space Force contract for AI training system appeared first on SpaceNews.",Spaceflight News API,spaceflight_news,2026-01-15 13:30:00+00:00,satellite_deployment,True,False,['United States of America'],['US Space Force'],35416,2026-01-17 20:56:32.686512
"NASA’s SpaceX Crew-11 Mission Returns, Splashes Down off California","NASA’s SpaceX Crew-11 mission safely splashed down early Thursday morning in the Pacific Ocean off the coast of San Diego, concluding a more than five-month mission aboard the International Space Station. NASA astronauts Zena Cardman and Mike Fincke, JAXA (Japan Aerospace Exploration Agency) astronaut Kimiya Yui, and Roscosmos cosmonaut Oleg Platonov returned to Earth at […]",Spaceflight News API,spaceflight_news,2026-01-15 10:59:03+00:00,launch,True,False,"['Japan', 'Russia', 'United States of America']","['JAXA', 'NASA', 'Roscosmos', 'SpaceX']",35414,2026-01-17 20:56:32.689036
Crew 11 safely splashes down after shortened mission,"Four space station crewmates undocked and plunged back to Earth Thursday, safely splashing down in the Pacific Ocean off the California coast six days after NASA ordered them home early because of a medical issue.",Spaceflight News API,spaceflight_news,2026-01-15 10:47:21+00:00,launch,True,False,['United States of America'],['NASA'],35413,2026-01-17 20:56:32.690807
Indian startup Aule Space enters satellite servicing market,"
An Indian startup is entering the satellite servicing market with plans to develop low-cost spacecraft to extend the lives of satellites.
The post Indian startup Aule Space enters satellite servicing market appeared first on SpaceNews.",Spaceflight News API,spaceflight_news,2026-01-15 08:33:28+00:00,satellite_deployment,True,False,['India'],[],35409,2026-01-17 20:56:32.692808
Sentinel-2 explores night vision,"After more than 10 years in orbit, the first Copernicus Sentinel-2 satellite, Sentinel-2A, is still finding new ways to contribute to Earth observation. With its younger siblings, Sentinel-2B and Sentinel-2C, now leading the mission’s core task of delivering high-resolution, ‘camera-like’ images of Earth’s surface, the European Space Agency is pushing Sentinel-2A beyond its original remit.",Spaceflight News API,spaceflight_news,2026-01-15 08:00:00+00:00,launch,True,False,[],['ESA'],35408,2026-01-17 20:56:32.695036
Spaceflight study links astronaut biology to reversible shifts in epigenetic age,"Los Angeles CA (SPX) Jan 14, 2026


When the four member crew of Axiom 2 launched on a 10 day mission in May 2023, their time in orbit carried a dense manifest of biomedical experiments aimed at probing human physiology under spaceflight conditions. 

A new analysis led by scientists at the Buck Institute for Research on Aging uses blood samples from that mission to position spaceflight as a model system for studying biologica",Spaceflight News API,spaceflight_news,2026-01-15 07:55:13+00:00,launch,True,False,[],[],35403,2026-01-17 20:56:32.697656
NASA and DOE plan fission power plant on Moon by 2030,"Los Angeles CA (SPX) Jan 15, 2026


NASA and the U.S. Department of Energy have renewed their long standing partnership to develop a fission surface power system that can operate on the Moon as part of the Artemis campaign and future missions to Mars. The agencies plan to deploy a lunar surface reactor by 2030 to support sustained human and robotic activities and to advance U.S. leadership in space exploration and commerce.",Spaceflight News API,spaceflight_news,2026-01-15 07:55:13+00:00,launch,True,False,['United States of America'],['NASA'],35400,2026-01-17 20:56:32.700205
JAXA taps ispace for lunar debris mitigation and disposal study,"Tokyo, Japan (SPX) Jan 15, 2026


ispace inc has been selected by the Japan Aerospace Exploration Agency to conduct an analysis on how to limit harmful space debris in lunar orbit and manage spacecraft end of life on the Moon as activity around the lunar environment increases. The contracted study is titled ""Analysis for Space Debris Mitigation in Lunar Orbit and Disposal Management on the Lunar Surface"" and reflects growing con",Spaceflight News API,spaceflight_news,2026-01-15 07:55:13+00:00,policy_or_corporate,True,False,['Japan'],['JAXA'],35405,2026-01-17 20:56:32.702779
The Silent Partner - How Machine Learning Quietly Powers Modern Space Operations,"Los Angeles CA (SPX) Jan 15, 2026

The space industry handles some of the most complex data in existence. Satellite images cover millions of square kilometers. Telemetry from a single spacecraft involves thousands of data points. The position of millions of objects in orbit must be tracked to prevent collisions",Spaceflight News API,spaceflight_news,2026-01-15 07:55:13+00:00,satellite_deployment,True,False,[],[],35402,2026-01-17 20:56:32.705334
"Coverage, Briefing Set for NASA’s Artemis II Moon Rocket Roll to Pad","NASA’s integrated SLS (Space Launch System) rocket and Orion spacecraft for the Artemis II mission is inching closer to launch – literally. The agency is targeting no earlier than 7 a.m. EST, Saturday, Jan. 17, to begin the multi-hour trek from the Vehicle Assembly Building to Launch Pad 39B at NASA’s Kennedy Space Center in […]",Spaceflight News API,spaceflight_news,2026-01-14 22:26:49+00:00,launch,True,False,['United States of America'],['NASA'],35398,2026-01-17 20:56:32.707873
CAS Space conducts first suborbital launch and capsule landing test,"
Chinese commercial firm CAS Space launched its first Lihong-1 suborbital flight and recovery test mission, seeing a successful parachute descent of the capsule.
The post CAS Space conducts first suborbital launch and capsule landing test appeared first on SpaceNews.",Spaceflight News API,spaceflight_news,2026-01-14 21:41:33+00:00,launch,True,False,['China'],[],35397,2026-01-17 20:56:32.709944
ESA’s Comet Interceptor mission moves up launch,"A delay in one European Space Agency mission is creating an opportunity for an earlier, and more capable, launch for another ESA spacecraft.
The post ESA’s Comet Interceptor mission moves up launch appeared first on SpaceNews.",Spaceflight News API,spaceflight_news,2026-01-14 18:24:00+00:00,launch,True,False,[],['ESA'],35393,2026-01-17 20:56:32.712025
"Taiwan’s Moonshot: why ‘T-Dome’ needs systems engineering, not just a shopping list","
When President John F. Kennedy stood before Congress in May 1961 and declared that the United States would land a man on the moon before the decade’s end, his purpose was not to invent the space program, but to impose a clear objective, a deadline and the resources to unify these efforts. The success of […]
The post Taiwan’s Moonshot: why ‘T-Dome’ needs systems engineering, not just a shopping list appeared first on SpaceNews.",Spaceflight News API,spaceflight_news,2026-01-14 18:00:00+00:00,policy_or_corporate,True,False,"['Taiwan', 'United States of America']",[],35392,2026-01-17 20:56:32.714753
Space sustainability will evolve into a data-driven system,"
If you stayed in a hotel last night, there’s a good chance you saw that familiar placard in the bathroom: “Help save the planet — hang your towel and we won’t wash it.” At a recent panel, I asked the audience how many had seen that sign. Most hands went up. Then I asked them […]
The post Space sustainability will evolve into a data-driven system appeared first on SpaceNews.",Spaceflight News API,spaceflight_news,2026-01-14 16:00:00+00:00,policy_or_corporate,True,False,[],[],35391,2026-01-17 20:56:32.717434
ThinkOrbital raises seed funding to advance X-ray space inspection,"
Boulder-based startup plans 2026 demonstrations tied to space domain awareness
The post ThinkOrbital raises seed funding to advance X-ray space inspection appeared first on SpaceNews.",Spaceflight News API,spaceflight_news,2026-01-14 15:00:00+00:00,policy_or_corporate,True,False,[],[],35390,2026-01-17 20:56:32.719287
European Capsule Demonstrator Survives Launch Failure,"A small reentry capsule demonstrator developed by Spanish space logistics startup Orbital Paradigm survived the failure of its PSLV launch vehicle on 12 January and successfully transmitted 190 seconds of flight data. Valencia-based Orbital Paradigm was founded in 2023 and is developing a reusable capsule called Kestrel that will be able to host payloads of […]
The post European Capsule Demonstrator Survives Launch Failure appeared first on European Spaceflight.",Spaceflight News API,spaceflight_news,2026-01-14 14:11:08+00:00,launch,True,False,['Spain'],['ESA'],35388,2026-01-17 20:56:32.722536
"When allies can’t count on U.S. ISR, commercial space becomes strategic","
The global security environment is becoming more volatile, not less. The war in Ukraine grinds on. China is increasingly assertive in the Indo-Pacific. The Middle East remains unstable. North Korea continues to test missiles and challenge regional stability. Together, these dynamics are straining the international system in ways not seen since the early Cold War. […]
The post When allies can’t count on U.S. ISR, commercial space becomes strategic appeared first on SpaceNews.",Spaceflight News API,spaceflight_news,2026-01-14 13:00:00+00:00,security_event,True,False,"['China', 'North Korea', 'Ukraine']",[],35384,2026-01-17 20:56:32.726015
Space operations will become more dynamic this year,"
From civil science and exploration missions to national security, there are many space activities to look forward to in 2026. There will be at least three missions heading to the moon, Vast’s Haven-1 is scheduled to launch as the first prospective commercial low Earth orbit (LEO) destination. But perhaps more importantly, there will be a […]
The post Space operations will become more dynamic this year appeared first on SpaceNews.",Spaceflight News API,spaceflight_news,2026-01-14 12:00:00+00:00,launch,True,False,[],[],35382,2026-01-17 20:56:32.728865
