title,summary,source,source_api,published_date,event_type,is_space_related,is_security_related,countries,entities,raw_source,time_classified
Blue Origin’s Cape Campus continues to expand ahead of New Glenn ramp-up,"Blue Origin’s rocket factory in Florida’s Exploration Park is undergoing rapid transformation as the company…
The post Blue Origin’s Cape Campus continues to expand ahead of New Glenn ramp-up appeared first on NASASpaceFlight.com.",Spaceflight News API,spaceflight_news,2025-12-11 03:37:38+00:00,launch,True,False,[],['Blue Origin'],34657,2026-01-17 20:56:33.554229
Live coverage: SpaceX to launch 29 Starlink satellites on Falcon 9 rocket from Cape Canaveral,The Starlink 6-90 mission will launch on a Falcon 9 rocket flying a south-easterly trajectory after leaving from Cape Canaveral Space Force Station. Liftoff from pad 40 is scheduled for 3:26 p.m. EST (2026 UTC).,Spaceflight News API,spaceflight_news,2025-12-11 01:36:43+00:00,launch,True,False,['United States of America'],"['SpaceX', 'US Space Force']",34655,2026-01-17 20:56:33.556099
L3Harris satellite-jamming system approved for export to close U.S. allies,"
Lt. Gen. Phil Garrant, head of the Space Systems Command, said  Five Eyes partners would likely have access to this technology
The post L3Harris satellite-jamming system approved for export to close U.S. allies appeared first on SpaceNews.",Spaceflight News API,spaceflight_news,2025-12-11 00:31:30+00:00,security_event,True,True,[],['L3Harris'],34653,2026-01-17 20:56:33.557996
Blue Origin targets four-flight campaign for New Glenn’s path to Space Force certification,"
Lt. Gen. Phil Garrant, who leads the Space Systems Command, said Blue Origin selected the four-flight benchmark and the government agreed
The post Blue Origin targets four-flight campaign for New Glenn’s path to Space Force certification appeared first on SpaceNews.",Spaceflight News API,spaceflight_news,2025-12-10 23:30:29+00:00,launch,True,False,['United States of America'],"['Blue Origin', 'US Space Force']",34651,2026-01-17 20:56:33.559921
Multiple space companies join NATO’s DIANA defense accelerator,"
NATO has picked 150 companies from 24 of its member countries to join its Defence Innovation Accelerator for the North Atlantic next year, including more than two dozen with ties to the space sector.
The post Multiple space companies join NATO’s DIANA defense accelerator appeared first on SpaceNews.",Spaceflight News API,spaceflight_news,2025-12-10 20:58:39+00:00,policy_or_corporate,True,True,[],['NATO'],34648,2026-01-17 20:56:33.561892
25 Years of Space Station Technology Driving Exploration,"NASA and its partners have supported humans continuously living and working in space since November 2000. After 25 years of habitation, the International Space Station continues to be a proving ground for technology that powers NASA’s Artemis campaign, future lunar missions, and human exploration of Mars.   Take a look at key technology advancements made […]",Spaceflight News API,spaceflight_news,2025-12-10 20:50:03+00:00,launch,True,False,['United States of America'],['NASA'],34646,2026-01-17 20:56:33.563980
"After key Russian launch site is damaged, NASA accelerates Dragon supply missions",It is by no means certain that Russia will be able to fix Site 31 soon.,Spaceflight News API,spaceflight_news,2025-12-10 18:13:52+00:00,launch,True,False,"['Russia', 'United States of America']",['NASA'],34645,2026-01-17 20:56:33.565363
Helsing and Kongsberg plot multi-mission European defense space network,"
Two defense technology companies from Norway and Germany have joined forces to bolster Europe’s sovereign intelligence and communications capabilities, with plans to start deploying small satellites in about three years.
The post Helsing and Kongsberg plot multi-mission European defense space network appeared first on SpaceNews.",Spaceflight News API,spaceflight_news,2025-12-10 17:44:55+00:00,launch,True,True,"['Germany', 'Norway']",['ESA'],34642,2026-01-17 20:56:33.567280
"China launches new TJS satellite, commercial Kinetica-1 lofts 9 spacecraft","China continued a surge in launch activity with a pair of missions Tuesday, adding to an opaque satellite series and launching new remote sensing satellites.
The post China launches new TJS satellite, commercial Kinetica-1 lofts 9 spacecraft appeared first on SpaceNews.",Spaceflight News API,spaceflight_news,2025-12-10 17:36:52+00:00,launch,True,False,['China'],[],34643,2026-01-17 20:56:33.569133
"Colliding space debris produces radio bursts, raising prospect of ‘debris weather’ alerts","
GOLDEN, CO — A university team has found that small orbital debris could emit radio bursts as they collide or approach each other in space. The signal can be detected with large radio dishes on Earth, as well as satellites in orbit.  This new intelligence agency-funded research is focused on gauging the interaction of orbital debris […]
The post Colliding space debris produces radio bursts, raising prospect of ‘debris weather’ alerts appeared first on SpaceNews.",Spaceflight News API,spaceflight_news,2025-12-10 17:36:51+00:00,satellite_deployment,True,False,[],[],34644,2026-01-17 20:56:33.571744
Odin Space raises $3 million in seed funding,"
SAN FRANCISCO – British startup Odin Space raised $3 million in a seed round to begin commercializing tiny sensors to map and analyze sub-centimeter orbital debris. With its first sensor launched in 2023 on D-Orbit’s ION orbital transfer vehicle, Odin demonstrated its ability to detect debris that’s generally too small to track but still capable […]
The post Odin Space raises $3 million in seed funding appeared first on SpaceNews.",Spaceflight News API,spaceflight_news,2025-12-10 17:23:15+00:00,launch,True,False,['United Kingdom'],[],34641,2026-01-17 20:56:33.574125
How multi-agent AI can strengthen space missions against the unknown,"
Space missions are entering a new era defined by complexity: more sensors, more software-driven behavior, more tightly coupled subsystems and more interactions between spacecraft and orbital infrastructure. As these systems evolve, the number of potential failure modes grows — ranging from thermal drift and aging hardware to configuration errors, environmental disturbances, and unfamiliar system behavior. […]
The post How multi-agent AI can strengthen space missions against the unknown appeared first on SpaceNews.",Spaceflight News API,spaceflight_news,2025-12-10 14:00:00+00:00,launch,True,False,[],[],34639,2026-01-17 20:56:33.577336
Benchmark demonstrates high-throughput ASCENT thruster in hotfire testing at Edwards Air Force Base,"
SAN FRANCISCO – Benchmark Space Systems’ ASCENT-fueled Macaw thruster performed a 10-minute continuous burn, clearing the way for an on-orbit application of the propulsion technology, the company announced Dec. 10. “Because ASCENT has 50% greater impulse density than other monopropellants, mission planners and spacecraft designers can get the similar delta-v [change in velocity] with less […]
The post Benchmark demonstrates high-throughput ASCENT thruster in hotfire testing at Edwards Air Force Base appeared first on SpaceNews.",Spaceflight News API,spaceflight_news,2025-12-10 13:00:00+00:00,launch,True,False,[],[],34637,2026-01-17 20:56:33.580226
Overview Energy demonstrates technologies for space solar power,"
A space solar power startup has emerged from stealth after demonstrating a key technology for its plans to transmit power from space to the Earth.
The post Overview Energy demonstrates technologies for space solar power appeared first on SpaceNews.",Spaceflight News API,spaceflight_news,2025-12-10 12:05:30+00:00,policy_or_corporate,True,False,[],[],34635,2026-01-17 20:56:33.582063
Shine bright like a satellite,From the ESA Blogs.,Spaceflight News API,spaceflight_news,2025-12-10 11:37:00+00:00,satellite_deployment,True,False,[],['ESA'],34634,2026-01-17 20:56:33.582914
LEO internet satellites bolster navigation where GPS is weak,"Columbus, OH (SPX) Dec 05, 2025


As intentional and unintentional interference with GPS grows worldwide, researchers have shown that radio signals from commercial low Earth orbit (LEO) internet constellations such as Starlink and OneWeb can provide an alternative source of navigation and positioning, especially in regions where GNSS performance is degraded. The new work indicates that passively received LEO signals can be turne",Spaceflight News API,spaceflight_news,2025-12-10 10:49:13+00:00,security_event,True,True,[],"['OneWeb', 'SpaceX']",34629,2026-01-17 20:56:33.585252
MDA Space plans C250 million senior unsecured note issue maturing 2030,"Los Angeles CA (SPX) Dec 05, 2025


MDA Space Ltd. has arranged a private placement of C$250 million in 7.00 percent senior unsecured notes due 2030 under an underwriting agreement. The company expects the offering to close around December 23, 2025, subject to customary closing conditions. The notes will be issued at C$1,000 for each C$1,000 in principal. 

The notes will rank equally in right of payment with all existing and",Spaceflight News API,spaceflight_news,2025-12-10 10:49:13+00:00,policy_or_corporate,True,False,[],['Missile Defense Agency'],34630,2026-01-17 20:56:33.587682
Canadian radar satellite contract positions MDA Space for RADARSAT replenishment role,"Los Angeles CA (SPX) Dec 05, 2025


MDA Space has secured a $44.7 million contract from Public Services and Procurement Canada, acting for the Canadian Space Agency, to procure and deliver critical long lead parts in support of the RADARSAT Constellation Mission replenishment satellite development. 

The Government of Canada has also signalled its intention to award MDA Space the full contract in 2026 to build, test, and launc",Spaceflight News API,spaceflight_news,2025-12-10 10:49:13+00:00,launch,True,False,['Canada'],['Missile Defense Agency'],34628,2026-01-17 20:56:33.590163
SLI and AscendArc agree on 200 million GEO satellite leasing framework,"Los Angeles CA (SPX) Dec 04, 2025


Aerospace asset finance firm SLI has signed heads of agreement to acquire two of AscendArc's next-generation Ka-band geostationary satellites, in a transaction valued at more than $200 million. The framework sits within a wider partnership that allows AscendArc to make its GEO spacecraft available on leasing terms instead of requiring customers to fund an outright purchase. 

Through SLI's f",Spaceflight News API,spaceflight_news,2025-12-10 10:49:13+00:00,satellite_deployment,True,False,[],['Other'],34632,2026-01-17 20:56:33.592646
Space shuttle design study maps path to breakthrough inventions,"Los Angeles CA (SPX) Dec 05, 2025


Researchers examining NASA's space shuttle development argue that the agency's design approach offers a template for creating breakthrough products that combine many interdependent features, from launch systems to smartphones and pharmaceuticals. They focus on how NASA generated internal knowledge for the shuttle program between 1969 and 1971, when engineers had to balance performance, cost, and",Spaceflight News API,spaceflight_news,2025-12-10 10:49:13+00:00,launch,True,False,['United States of America'],['NASA'],34627,2026-01-17 20:56:33.594962
Funding boost unlocks future space science programme,"In its 50th anniversary year, European Space Agency (ESA) Member States have recommitted to space science. A historic budget increase for the Science Programme of 3.5% per year through to 2028, in addition to inflation, will enable some of the most ambitious missions ever, and bolster European leadership in space science. ",Spaceflight News API,spaceflight_news,2025-12-10 10:00:00+00:00,launch,True,False,[],['ESA'],34633,2026-01-17 20:56:33.596981
ESA Publishes Call for Crew Launch Abort System,"The European Space Agency has published a call for tenders to develop a launch abort system for a future crewed launch capability. The system would be used in the event of an emergency, either on the launch pad or during the initial stages of flight. Published on 28 November, the day after the conclusion of […]
The post ESA Publishes Call for Crew Launch Abort System appeared first on European Spaceflight.",Spaceflight News API,spaceflight_news,2025-12-10 07:49:43+00:00,launch,True,False,[],['ESA'],34626,2026-01-17 20:56:33.599326
Live coverage: SpaceX to launch 160th Falcon 9 rocket of 2025,The Starlink 15-11 mission will add another 27 broadband internet satellites to the low Earth orbit megaconstellation. Liftoff from pad 4E at Vandenberg Space Force Base is scheduled for 3:40 a.m. PST (6:40 a.m. EST / 1140 UTC).,Spaceflight News API,spaceflight_news,2025-12-10 00:52:58+00:00,launch,True,False,['United States of America'],"['SpaceX', 'US Space Force']",34624,2026-01-17 20:56:33.601180
Chinese astronauts inspect debris-damaged Shenzhou-20 spacecraft during spacewalk,"Two Shenzhou-21 astronauts embarked on the mission’s first spacewalk late Monday, inspecting and photographing a damaged spacecraft window which triggered an earlier emergency launch.
The post Chinese astronauts inspect debris-damaged Shenzhou-20 spacecraft during spacewalk appeared first on SpaceNews.",Spaceflight News API,spaceflight_news,2025-12-09 19:07:28+00:00,launch,True,False,['China'],[],34619,2026-01-17 20:56:33.603631
Canada picks Telesat and MDA to study Arctic military communications constellation,"
Canada has contracted satellite operator Telesat and manufacturer MDA Space to explore options for a multibillion-dollar military communications network to support the Canadian Armed Forces in the Arctic.
The post Canada picks Telesat and MDA to study Arctic military communications constellation appeared first on SpaceNews.",Spaceflight News API,spaceflight_news,2025-12-09 18:13:48+00:00,satellite_deployment,True,True,['Canada'],"['Missile Defense Agency', 'Telesat']",34617,2026-01-17 20:56:33.605916
SCHOTT launches high-performance cover glass for next-generation space solar cells,"
– SCHOTT® Solar Glass exos provides enhanced radiation resistance and optical performance for simple silicon cells up to III-V multijunction satellite solar cells.– Jointly developed with Heilbronn-based AZUR SPACE Solar […]
The post SCHOTT launches high-performance cover glass for next-generation space solar cells appeared first on SpaceNews.",Spaceflight News API,spaceflight_news,2025-12-09 16:21:17+00:00,launch,True,False,[],[],34615,2026-01-17 20:56:33.608329
How Louisiana Native Turned Childhood Wonder into NASA Stennis Career,"Michelle Hoehn vividly remembers the day a seed was planted for her future at NASA’s Stennis Space Center near Bay St. Louis, Mississippi. As a seventh grader, the Bogalusa, Louisiana, native joined her dad for Father/Daughter Day at NASA Stennis. Hoehn knew she wanted to be part of something bigger, something that sparked wonder and […]",Spaceflight News API,spaceflight_news,2025-12-09 15:00:00+00:00,policy_or_corporate,True,False,['United States of America'],['NASA'],34611,2026-01-17 20:56:33.610711
Live coverage: SpaceX to launch classified payload for the National Reconnaissance Office,"The mission, dubbed NROL-77, is likely to be the final time SpaceX uses Landing Zone 2 to recover a first stage Falcon booster. Liftoff from pad 40 at Cape Canaveral Space Force Station is scheduled for 2:16 p.m. EST (1916 UTC).",Spaceflight News API,spaceflight_news,2025-12-09 14:35:37+00:00,security_event,True,False,['United States of America'],"['SpaceX', 'US Space Force']",34610,2026-01-17 20:56:33.612718
LeoLabs lands interagency contract to feed TraCSS and track adversarial spacecraft,"
LeoLabs has won an interagency contract to provide space-surveillance data for the U.S. government, supporting adversarial spacecraft monitoring and the TraCSS orbital traffic coordination platform due to enter full service early next year.
The post LeoLabs lands interagency contract to feed TraCSS and track adversarial spacecraft appeared first on SpaceNews.",Spaceflight News API,spaceflight_news,2025-12-09 14:01:00+00:00,security_event,True,False,[],['LeoLabs'],34608,2026-01-17 20:56:33.615069
Soyuz safely lands in Kazakhstan,"A NASA astronaut and two cosmonaut crewmates strapped into their Soyuz ferry ship Monday evening, undocked from the International Space Station and plunged to an on-target landing on the frigid steppe of Kazakhstan early Tuesday to wrap up an eight-month mission.",Spaceflight News API,spaceflight_news,2025-12-09 13:41:46+00:00,launch,True,False,"['Kazakhstan', 'Russia', 'United States of America']",['NASA'],34607,2026-01-17 20:56:33.617010
Finland’s ICEYE Closes €150 Million Series E Funding Round,"Finnish Earth observation data provider and Synthetic Aperture Radar (SAR) satellite manufacturer ICEYE has closed a new funding round, securing €150 million. Founded in 2014, ICEYE operates the world’s largest SAR satellite constellation, providing near-real-time insights day or night and in all weather conditions. It manufactures its satellites in-house, delivering spacecraft for its own Earth […]
The post Finland’s ICEYE Closes €150 Million Series E Funding Round appeared first on European Spaceflight.",Spaceflight News API,spaceflight_news,2025-12-09 12:59:40+00:00,launch,True,False,['Finland'],"['ESA', 'Iceye']",34606,2026-01-17 20:56:33.619830
Muon Space to develop sensor payload for missile defense satellites,"
The company is adapting commercial thermal-sensing tech for military applications
The post Muon Space to develop sensor payload for missile defense satellites appeared first on SpaceNews.",Spaceflight News API,spaceflight_news,2025-12-09 12:11:59+00:00,security_event,True,True,[],['Muon Space'],34605,2026-01-17 20:56:33.621389
Sea based rocket net recovery platform enters service for Chinese reusable launchers,"Tokyo, Japan (SPX) Dec 08, 2025


China has taken delivery of its first sea based platform designed to recover rockets using a net system, adding a key element to national plans for reusable launch vehicles. 

The vessel, named Linghangzhe or Pathfinder, has been certified by the China Classification Society, becoming the first sea based rocket recovery platform in the country to receive the required class and statutory appr",Spaceflight News API,spaceflight_news,2025-12-09 11:57:32+00:00,launch,True,False,"['China', 'Japan']",[],34598,2026-01-17 20:56:33.624289
Applied Aerospace and PCX create US flight and space hardware group,"Los Angeles CA (SPX) Dec 08, 2025


Applied Aerospace and PCX Aerosystems have merged to form Applied Aerospace and Defense, a single supplier focused on precision hardware and systems for aircraft, rotorcraft, satellites, launch vehicles, and missile defense programs across military, commercial, and scientific markets. 

The combined company draws on more than 120 years of engineering and manufacturing activity in mission cri",Spaceflight News API,spaceflight_news,2025-12-09 11:57:32+00:00,security_event,True,True,['United States of America'],[],34599,2026-01-17 20:56:33.626751
Lodestar Space wins SECP support to advance AI satellite awareness system,"London, UK (SPX) Dec 08, 2025


Lodestar Space has secured funding through the UK Space Agency's Space Ecosystem Commercialisation Programme, delivered by Space South Central, to accelerate work on its on-orbit sensing system Mithril. 

The SECP Sprint R and D grant of GBP 30,000 will pay for integration and testing of a new LiDAR sensor within Mithril's existing on-orbit sensing suite. Mithril is described as a fully auto",Spaceflight News API,spaceflight_news,2025-12-09 11:57:32+00:00,satellite_deployment,True,False,['United Kingdom'],['Lodestar Space'],34596,2026-01-17 20:56:33.629356
NASA to test commercial robotic arm in orbit to advance in space construction,"Greenbelt MD (SPX) Dec 08, 2025


NASA and industry partners will fly and operate a commercial robotic arm in low Earth orbit through the Fly Foundational Robots mission set to launch in late 2027. This mission will support development of in space operations that are needed for long duration human activities away from Earth and will help grow a commercial robotics sector that future science and exploration missions can use.",Spaceflight News API,spaceflight_news,2025-12-09 11:57:32+00:00,launch,True,False,['United States of America'],['NASA'],34600,2026-01-17 20:56:33.632040
Space debris looms over Google's ambitious orbital AI data center plan,"Ann Arbor MI (SPX) Dec 08, 2025


The rapid growth of artificial intelligence and cloud services is driving an enormous appetite for computing power, and with it, a surge in electricity demand from data centers that can rival the needs of tens of thousands of homes or even a small city. To ease that strain, some technology leaders are turning their attention to space, where sunlight is abundant and continuous, and where solar-po",Spaceflight News API,spaceflight_news,2025-12-09 11:57:32+00:00,policy_or_corporate,True,False,[],[],34601,2026-01-17 20:56:33.635002
"China launches 4 times in 4 days, boosting megaconstellation and surveillance assets","China launched four missions in four days, accelerating its record-setting launch cadence while expanding its Guowang LEO megaconstellation and deploying new Yaogan reconnaissance assets.
The post China launches 4 times in 4 days, boosting megaconstellation and surveillance assets appeared first on SpaceNews.",Spaceflight News API,spaceflight_news,2025-12-09 11:06:05+00:00,security_event,True,False,['China'],[],34602,2026-01-17 20:56:33.637347
Galileo pre-launch media briefing,"Watch the replay of the media briefing held ahead of the 14th operational launch of the Galileo programme. The briefing covers the mission details for the launch of two Galileo satellites, which are set to lift off on 17 December aboard Ariane 6 from Europe’s Spaceport in French Guiana.",Spaceflight News API,spaceflight_news,2025-12-09 11:00:00+00:00,launch,True,False,['France'],['ESA'],34603,2026-01-17 20:56:33.639391
"NASA Astronaut Jonny Kim, Crewmates Return from Space Station","NASA astronaut Jonny Kim returned to Earth on Tuesday alongside Roscosmos cosmonauts Sergey Ryzhikov and Alexey Zubritsky, wrapping up an eight-month science mission aboard the International Space Station to benefit life on Earth and future space exploration. They made a safe, parachute-assisted landing at 12:03 a.m. EST (10:03 a.m. local time), southeast of Dzhezkazgan, Kazakhstan, […]",Spaceflight News API,spaceflight_news,2025-12-09 06:36:21+00:00,launch,True,False,"['Kazakhstan', 'Russia', 'United States of America']","['NASA', 'Roscosmos']",34593,2026-01-17 20:56:33.641833
Private capital targets mission-critical software power and platforms in new space economy,"Los Angeles CA (SPX) Dec 09, 2025


Axle Point Capital and Balerion Space Ventures are directing new private capital into companies that build core infrastructure for the expanding U.S. space and defense economy, from mission software and guidance systems to deployable microreactors and high-temperature reactors. Axle Point's first transaction is a strategic equity investment in Odyssey Space Research LLC, a flight software and en",Spaceflight News API,spaceflight_news,2025-12-09 04:08:14+00:00,launch,True,True,[],['Odyssey Space Research'],34583,2026-01-17 20:56:33.644933
Neutron Hungry Hippo fairing completes qualification ahead of first launch,"Los Angeles CA (SPX) Dec 09, 2025


Rocket Lab Corporation has qualified the captive Hungry Hippo fairing for its Neutron launch vehicle and is sending the structure to Virginia for integration ahead of the rocket's debut mission. The fairing halves remain attached to Neutron's first stage from liftoff through landing, rather than separating and being discarded or recovered at sea. In flight, the halves open to release the second",Spaceflight News API,spaceflight_news,2025-12-09 04:08:14+00:00,launch,True,False,[],['Rocket Lab'],34584,2026-01-17 20:56:33.647714
"Launch Roundup: China, Russia, Rocket Lab, ULA join SpaceX in flying this week","The upcoming launch week, starting on Monday, Dec. 8, is a very busy one as…
The post Launch Roundup: China, Russia, Rocket Lab, ULA join SpaceX in flying this week appeared first on NASASpaceFlight.com.",Spaceflight News API,spaceflight_news,2025-12-08 22:50:25+00:00,launch,True,False,"['China', 'Russia']","['Rocket Lab', 'SpaceX', 'United Launch Alliance']",34581,2026-01-17 20:56:33.649500
Pentagon weighs consolidation of DIU tech portfolio,"
The ongoing review could have implications for space projects
The post Pentagon weighs consolidation of DIU tech portfolio appeared first on SpaceNews.",Spaceflight News API,spaceflight_news,2025-12-08 21:46:00+00:00,policy_or_corporate,True,False,['United States of America'],['Pentagon'],34580,2026-01-17 20:56:33.650882
How Spain and Poland pushed Europe’s new priorities with record contributions,"
MILAN – When the European Space Agency announced its new three-year spending plan last month, two countries stood out for the increased size of their contributions.  Poland boosted its budget from 198 million euros ($132 million) in 2022 to 735 million euros in 2025 (a 276% increase). Spain raised its contribution from 933 million euros […]
The post How Spain and Poland pushed Europe’s new priorities with record contributions appeared first on SpaceNews.",Spaceflight News API,spaceflight_news,2025-12-08 16:18:05+00:00,policy_or_corporate,True,False,"['Poland', 'Spain']",['ESA'],34544,2026-01-17 20:56:33.653687
